{
  "schemaVersion": 1,
  "id": "RPT-CI-34037435231-A1",
  "source": "github.retained-reports",
  "reportType": "ci-validation",
  "producer": {
    "provider": "github-actions",
    "repository": "SouthernGentlemen/wizardgang-architecture-demo",
    "workflow": "CI",
    "workflowRunId": 34037435231,
    "runAttempt": 1,
    "event": "push",
    "status": "completed",
    "conclusion": "success"
  },
  "sourceRevision": {
    "commit": "d195a19adc29e888d62e58d6518cf7d3ec51c211",
    "branch": "main"
  },
  "observedAt": "2026-09-06T13:54:09Z",
  "status": "passed",
  "qualification": "GitHub marked the workflow run successful. Individual job and step outcomes remain explicit, including skipped execution; no unexecuted check is inferred to have passed.",
  "checks": [
    {
      "id": 101497965119,
      "name": "validate",
      "status": "completed",
      "conclusion": "success",
      "outcome": "passed",
      "startedAt": "2026-09-06T13:52:54Z",
      "completedAt": "2026-09-06T13:54:08Z",
      "evidence": {
        "kind": "job",
        "url": "https://github.com/SouthernGentlemen/wizardgang-architecture-demo/actions/runs/34037435231/job/101497965119"
      },
      "steps": [
        {
          "number": 1,
          "name": "Set up job",
          "status": "completed",
          "conclusion": "success",
          "outcome": "passed",
          "startedAt": "2026-09-06T13:52:55Z",
          "completedAt": "2026-09-06T13:52:56Z"
        },
        {
          "number": 2,
          "name": "Run actions/checkout@v5",
          "status": "completed",
          "conclusion": "success",
          "outcome": "passed",
          "startedAt": "2026-09-06T13:52:56Z",
          "completedAt": "2026-09-06T13:52:57Z"
        },
        {
          "number": 3,
          "name": "Run actions/setup-node@v5",
          "status": "completed",
          "conclusion": "success",
          "outcome": "passed",
          "startedAt": "2026-09-06T13:52:57Z",
          "completedAt": "2026-09-06T13:53:00Z"
        },
        {
          "number": 4,
          "name": "Install locked dependencies",
          "status": "completed",
          "conclusion": "success",
          "outcome": "passed",
          "startedAt": "2026-09-06T13:53:00Z",
          "completedAt": "2026-09-06T13:53:10Z"
        },
        {
          "number": 5,
          "name": "Full repository check",
          "status": "completed",
          "conclusion": "success",
          "outcome": "passed",
          "startedAt": "2026-09-06T13:53:10Z",
          "completedAt": "2026-09-06T13:53:57Z"
        },
        {
          "number": 6,
          "name": "Apply D1 migrations to a clean local database",
          "status": "completed",
          "conclusion": "success",
          "outcome": "passed",
          "startedAt": "2026-09-06T13:53:57Z",
          "completedAt": "2026-09-06T13:54:02Z"
        },
        {
          "number": 7,
          "name": "Audit dependencies",
          "status": "completed",
          "conclusion": "success",
          "outcome": "passed",
          "startedAt": "2026-09-06T13:54:02Z",
          "completedAt": "2026-09-06T13:54:03Z"
        },
        {
          "number": 8,
          "name": "Validate Worker build",
          "status": "completed",
          "conclusion": "success",
          "outcome": "passed",
          "startedAt": "2026-09-06T13:54:03Z",
          "completedAt": "2026-09-06T13:54:05Z"
        },
        {
          "number": 9,
          "name": "Validate patch whitespace",
          "status": "completed",
          "conclusion": "success",
          "outcome": "passed",
          "startedAt": "2026-09-06T13:54:05Z",
          "completedAt": "2026-09-06T13:54:05Z"
        },
        {
          "number": 17,
          "name": "Post Run actions/setup-node@v5",
          "status": "completed",
          "conclusion": "success",
          "outcome": "passed",
          "startedAt": "2026-09-06T13:54:05Z",
          "completedAt": "2026-09-06T13:54:05Z"
        },
        {
          "number": 18,
          "name": "Post Run actions/checkout@v5",
          "status": "completed",
          "conclusion": "success",
          "outcome": "passed",
          "startedAt": "2026-09-06T13:54:05Z",
          "completedAt": "2026-09-06T13:54:05Z"
        },
        {
          "number": 19,
          "name": "Complete job",
          "status": "completed",
          "conclusion": "success",
          "outcome": "passed",
          "startedAt": "2026-09-06T13:54:05Z",
          "completedAt": "2026-09-06T13:54:05Z"
        }
      ]
    },
    {
      "id": 101497966097,
      "name": "change-id",
      "status": "completed",
      "conclusion": "skipped",
      "outcome": "skipped",
      "startedAt": "2026-09-06T13:52:52Z",
      "completedAt": "2026-09-06T13:52:52Z",
      "evidence": {
        "kind": "job",
        "url": "https://github.com/SouthernGentlemen/wizardgang-architecture-demo/actions/runs/34037435231/job/101497966097"
      },
      "steps": []
    }
  ],
  "evidence": [
    {
      "kind": "workflow-run",
      "url": "https://github.com/SouthernGentlemen/wizardgang-architecture-demo/actions/runs/34037435231"
    },
    {
      "kind": "source-revision",
      "url": "https://github.com/SouthernGentlemen/wizardgang-architecture-demo/commit/d195a19adc29e888d62e58d6518cf7d3ec51c211"
    },
    {
      "kind": "job",
      "url": "https://github.com/SouthernGentlemen/wizardgang-architecture-demo/actions/runs/34037435231/job/101497965119"
    },
    {
      "kind": "job",
      "url": "https://github.com/SouthernGentlemen/wizardgang-architecture-demo/actions/runs/34037435231/job/101497966097"
    }
  ],
  "relationships": [
    {
      "relation": "producedBy",
      "from": {
        "source": "github.retained-reports",
        "native": "SouthernGentlemen/wizardgang-architecture-demo|github.retained-reports|RPT-CI-34037435231-A1"
      },
      "to": {
        "source": "github.workflow-runs",
        "native": "SouthernGentlemen/wizardgang-architecture-demo|github.workflow-runs|34037435231",
        "revision": "1"
      }
    },
    {
      "relation": "evaluatesRevision",
      "from": {
        "source": "github.retained-reports",
        "native": "SouthernGentlemen/wizardgang-architecture-demo|github.retained-reports|RPT-CI-34037435231-A1"
      },
      "to": {
        "source": "github.commits",
        "native": "SouthernGentlemen/wizardgang-architecture-demo|github.commits|d195a19adc29e888d62e58d6518cf7d3ec51c211",
        "revision": "d195a19adc29e888d62e58d6518cf7d3ec51c211"
      }
    }
  ]
}
